{
  "schema_version": "1.0.0",
  "id": "claude",
  "version": "2.0.0",
  "manifest_root": ".claude-plugin",
  "config_root": ".claude",
  "command_map": "scripts/adapters/claude/command-map.json",
  "hook_adapter": "scripts/hooks/context-hook.py",
  "progress_adapter": "scripts/spex-ship-statusline.sh",
  "subagent_adapter": null,
  "capabilities": {
    "installation": {
      "status": "native"
    },
    "interaction": {
      "status": "native"
    },
    "hooks": {
      "status": "native"
    },
    "permissions": {
      "status": "native"
    },
    "progress": {
      "status": "native"
    },
    "status_line": {
      "status": "native"
    },
    "context_lifecycle": {
      "status": "adapted"
    },
    "worktrees": {
      "status": "adapted"
    },
    "subagents": {
      "status": "native"
    }
  },
  "permission_profiles": {
    "safe": {
      "mode": "inherit",
      "scope": "host-policy"
    },
    "autonomous": {
      "mode": "allowlisted",
      "scope": "repository-and-feature-worktrees",
      "network": "host-approval",
      "external_actions": "host-approval",
      "destructive_actions": "host-approval"
    },
    "yolo": {
      "mode": "non-destructive-workspace",
      "scope": "repository-and-feature-worktrees",
      "network": "host-approval",
      "external_actions": "host-approval",
      "destructive_actions": "host-approval"
    }
  }
}
